http://casa-m-site.casa-cloud.vpc.realestate.com.au/affitti-commerciale/lista-1;Immobili commerciali in affitto, annunci immobiliari - Casa.it;;Scopri i nostri annunci immobiliari di Immobili Commerciali In Affitto e scegli la soluzione giusta per te. Qualunque immobile commerciale cerchi, è gia su Casa.it!
http://casa-m-site.casa-cloud.vpc.realestate.com.au/affitti-residenziale/lista-1;Case in affitto, annunci immobiliari - Casa.it;;Scopri i nostri annunci immobiliari di Case In Affitto e scegli la soluzione giusta per te. Qualunque casa cerchi, è gia su Casa.it!
http://casa-m-site.casa-cloud.vpc.realestate.com.au/affitti-vacanze/lista-1;Affitto case vacanze, annunci immobiliari - Casa.it;;Scopri i nostri annunci immobiliari di Case Vacanze In Affitto e scegli la soluzione giusta per te. Qualunque casa cerchi, è gia su Casa.it!
http://casa-m-site.casa-cloud.vpc.realestate.com.au/affitti-commerciale/lista-2;Immobili commerciali in affitto, annunci immobiliari, pagina 2 - Casa.it;;
http://casa-m-site.casa-cloud.vpc.realestate.com.au/affitti-residenziale/lista-2;Case in affitto, annunci immobiliari, pagina 2 - Casa.it;;
http://casa-m-site.casa-cloud.vpc.realestate.com.au/affitti-vacanze/lista-2;Affitto case vacanze, annunci immobiliari, pagina 2 - Casa.it;;
http://casa-m-site.casa-cloud.vpc.realestate.com.au/vendita-commerciale/lista-1;Immobili commerciali in vendita, annunci immobiliari - Casa.it;;Scopri i nostri annunci immobiliari di Immobili Commerciali In Vendita e scegli la soluzione giusta per te. Qualunque immobile commerciale cerchi, è gia su Casa.it!
http://casa-m-site.casa-cloud.vpc.realestate.com.au/vendita-residenziale/lista-1;Case in vendita, annunci immobiliari - Casa.it;;Scopri i nostri annunci immobiliari di Case In Vendita e scegli la soluzione giusta per te. Qualunque casa cerchi, è gia su Casa.it!
http://casa-m-site.casa-cloud.vpc.realestate.com.au/vendita-vacanze/lista-1;Vendita case vacanze, annunci immobiliari - Casa.it;;Scopri i nostri annunci immobiliari di Case Vacanze In Vendita e scegli la soluzione giusta per te. Qualunque casa cerchi, è gia su Casa.it!
http://casa-m-site.casa-cloud.vpc.realestate.com.au/vendita-commerciale/lista-2;Immobili commerciali in vendita, annunci immobiliari, pagina 2 - Casa.it;;
http://casa-m-site.casa-cloud.vpc.realestate.com.au/vendita-residenziale/lista-2;Case in vendita, annunci immobiliari, pagina 2 - Casa.it;;
http://casa-m-site.casa-cloud.vpc.realestate.com.au/vendita-vacanze/lista-2;Vendita case vacanze, annunci immobiliari, pagina 2 - Casa.it;;
http://casa-m-site.casa-cloud.vpc.realestate.com.au/vendita-residenziale/immobile-terreno+edificabile-terreno-terratetto+terracielo-rustico+casale-posto+barca-porzione+di+casa-palazzo-monolocale-mansarda-loft-immobile+storico-immobile+di+prestigio-garage+box+auto-castello-casa+indipendente-casa+bi+trifamiliare-cantina+solaio-bungalow-baita+chalet+trullo-attico-appartamento/lista-1;Appartamenti, Attici, Baite, Chalet, Trulli, Bungalow, Cantine, Solai, Case Bifamiliari, Trifamiliari, Case indipendenti, Castelli, Garage, Box auto, Immobili di prestigio, Immobili storici, Loft, Mansarde, Monolocali, Palazzi, Porzioni di casa, Posti Barca, Rustici, Casali, Terratetto, Terracielo, Terreni, Terreni edificabili in vendita, annunci immobiliari - Casa.it;;Scopri i nostri annunci immobiliari di Appartamenti, Attici, Baite, Chalet, Trulli, Bungalow, Cantine, Solai, Case Bifamiliari, Trifamiliari, Case Indipendenti, Castelli, Garage, Box Auto, Immobili Di Prestigio, Immobili Storici, Loft, Mansarde, Monolocali, Palazzi, Porzioni Di Casa, Posti Barca, Rustici, Casali, Terratetto, Terracielo, Terreni, Terreni Edificabili In Vendita e scegli la soluzione giusta per te. Qualunque appartamento, attico, baita, chalet, trullo, bungalow, cantina, solaio, casa bi, trifamiliare, casa indipendente, castello, garage, box auto, immobile di prestigio, immobile storico, loft, mansarda, monolocale, palazzo, porzione di casa, posto barca, rustico, casale, terratetto, terracielo, terreno, terreno edificabile cerchi, è gia su Casa.it!
http://casa-m-site.casa-cloud.vpc.realestate.com.au/vendita-commerciale/immobile-attivita+licenza+comm/lista-1;Attività, Licenze commerciali in vendita, annunci immobiliari - Casa.it;;Scopri i nostri annunci immobiliari di Attività, Licenze Commerciali In Vendita e scegli la soluzione giusta per te. Qualunque attività, licenze commerciale cerchi, è gia su Casa.it!
http://casa-m-site.casa-cloud.vpc.realestate.com.au/vendita-commerciale/immobile-garage+auto+silos-attivita+licenza+comm-superficie-mq-0-20-per-50000-qualsiasi/lista-1;Attività, Licenze commerciali, Garage, Auto silos in vendita, annunci immobiliari - Casa.it;;Scopri i nostri annunci immobiliari di Attività, Licenze Commerciali, Garage, Auto Silos In Vendita e scegli la soluzione giusta per te. Qualunque attività, licenze commerciale, garage, auto silos cerchi, è gia su Casa.it!